wa1000bih1.txt	1000	Verzekering weigert vaker te betalen	20140430	België
wa1000bih2.txt	1000	Meer mensen krijgen leefloon	20140430	België
wa1000bik1.txt	1000	Buren willen patiënten weg	20140430	België
wa1000bik2.txt	1000	Opnieuw werken na depressie	20140430	België
wa1000bik3.txt	1000	Tien keer 1.000 gram afval	20140430	België
wa1000bik4.txt	1000	1000 kilometer tegen kanker	20140430	België
wa1000bik5.txt	1000	Vakbond ACOD staakt	20140430	België
wa1000bik6.txt	1000	Scholieren willen betere onderwijzers	20140430	België
wa1000bik7.txt	1000	Op de motor door 1.000 bochten	20140430	België
wa1000bik8.txt	1000	De eerste 1000 dagen	20140430	België
wa1000bin1.txt	1000	Parlementen stoppen	20140430	België
wa1000bin2.txt	1000	Nieuwe regels voor natuur	20140430	België
wa1000bin3.txt	1000	Dienst voor belastingen naar rechtbank in zaak tegen Karel De Gucht	20140430	België
wa1000bui1.txt	1000	Eerste minister Zuid-Korea neemt ontslag	20140430	Buitenland
wa1000bui2.txt	1000	Groot-Brittannië erkent Cornwall	20140430	Buitenland
wa1000bui3.txt	1000	Sherpa's staken	20140430	Buitenland
wa1000buk1.txt	1000	Oorlog dreigt in Zuid-Soedan	20140430	Buitenland
wa1000buk2.txt	1000	Hamas en PLO werken samen	20140430	Buitenland
wa1000buk3.txt	1000	Ei van 1000 jaar	20140430	Buitenland
wa1000buk4.txt	1000	Het jaar 1000	20140430	Buitenland
wa1000idk1.txt	1000	Volg de verkiezingen bij Wablieft	20140430	In de kijker
wa1000idk2.txt	1000	Hoe werkt onze democratie?	20140430	In de kijker
wa1000idk3.txt	1000	Wat is een staatshervorming?	20140430	In de kijker
wa1000idk4.txt	1000	De langste regeringsvorming ooit	20140430	In de kijker
wa1000mening.txt	1000	Voor iedereen	20140430	Mening
wa1000sam1.txt	1000	Axel Hirsoux: Ik heb muziek in mij, en ik wil dat delen	20140430	Samenleving
wa1000spk1.txt	1000	Michael Phelps is helemaal terug	20140430	Sport
wa1000spk2.txt	1000	Club Brugge leidt Play-Off 1	20140430	Sport
wa1000spk3.txt	1000	De race van 1.000 mijl	20140430	Sport
wa1000spk4.txt	1000	Doelpunt 1.000 van Pelé	20140430	Sport
wa1000spo1.txt	1000	Gerrans wint 100ste Luik-Bastenaken-Luik	20140430	Sport
wa1000spo2.txt	1000	Komt Euro 2020 naar Brussel?	20140430	Sport
wa1000spo3.txt	1000	Januzaj kiest voor de Rode Duivels	20140430	Sport
wa1000tip1.txt	1000	1000 zonnen' wijkt even voor voetbal	20140430	Tip
wa1000tip2.txt	1000	Bezoek de 1000 soorten-dag	20140430	Tip
wa1000tip3.txt	1000	Bijna de helft van 1.000	20140430	Tip
wa1000vp1.txt	1000	1.000 keer Wablieft	20140430	Voorpagina
wa1000vp2.txt	1000	Britse prinsen naar Bergen	20140430	Voorpagina
wa1000vp3.txt	1000	Rebellen gijzelen waarnemers	20140430	Voorpagina
wa1000we1.txt	1000	1000 jaar hoop	20140430	Weetjes
wa1000we2.txt	1000	Vreemde vogel	20140430	Weetjes
wa1000we3.txt	1000	Laura Lynn blijft scoren	20140430	Weetjes
wa1000we5.txt	1000	Koningin Máxima zonder benzine	20140430	Weetjes
wa1000we6.txt	1000	Gevaarlijke vlucht	20140430	Weetjes
wa1001bih1.txt	1001	Een kap op de Ring moet	20140507	België
wa1001bih2.txt	1001	Hersenen tonen risico op zelfmoord	20140507	België
wa1001bik1.txt	1001	Zeker 194 mensen blijven vermist	20140507	België
wa1001bik2.txt	1001	Jongen sterft door xtc-pil	20140507	België
wa1001bik3.txt	1001	Belastingbrief eenvoudiger	20140507	België
wa1001bik4.txt	1001	Agenten van karton helpen	20140507	België
wa1001bik5.txt	1001	Speeltuin moet weg	20140507	België
wa1001bik6.txt	1001	Vlaming bouwt te groot	20140507	België
wa1001bik7.txt	1001	Vakbondsleden maken minder kans	20140507	België
wa1001bik8.txt	1001	Jongens zoeken porno op internet	20140507	België
wa1001bin1.txt	1001	Grote grot ontdekt in Sprimont	20140507	België
wa1001bin2.txt	1001	Gevangenissen zitten te vol	20140507	België
wa1001bin3.txt	1001	Veel dieren dreigen uit te sterven	20140507	België
wa1001bui1.txt	1001	Gerry Adams opgepakt en weer vrij	20140507	Buitenland
wa1001bui2.txt	1001	Doden bij brand in Odessa	20140507	Buitenland
wa1001bui3.txt	1001	Boko Haram ontvoert schoolmeisjes	20140507	Buitenland
wa1001bui4.txt	1001	Natuurramp in Afghanistan	20140507	Buitenland
wa1001bui5.txt	1001	Portugal hoeft niet langer steun	20140507	Buitenland
wa1001buk1.txt	1001	Syrië organiseert verkiezingen	20140507	Buitenland
wa1001buk2.txt	1001	Grieken betogen opnieuw	20140507	Buitenland
wa1001buk3.txt	1001	Rellen in Istanboel	20140507	Buitenland
wa1001buk4.txt	1001	Varela wordt president Panama	20140507	Buitenland
wa1001idk1.txt	1001	Volg de verkiezingen bij Wablieft	20140507	In de kijker
wa1001idk2.txt	1001	Vlaamse Partijen: Vlaams Belang	20140507	In de kijker
wa1001idk3.txt	1001	Vlaamse Partijen: LDD	20140507	In de kijker
wa1001idk4.txt	1001	Vlaamse Partijen: PvdA	20140507	In de kijker
wa1001idk5.txt	1001	Wablieft: Meneer Van Besien, we vragen aan elke partij om de drie belangrijkste punten uit hun programma te kiezen. Welke punten zijn dat voor GROEN?	20140507	In de kijker
wa1001mening.txt	1001	Wel Belg, niet gek.	20140507	Mening
wa1001sam1.txt	1001	Sahim Omar Kalifa over 'Baghdad Messi'	20140507	Samenleving
wa1001spk1.txt	1001	Kristof Vandewalle is beste tijdrijder	20140507	Sport
wa1001spk2.txt	1001	Hanna Mariën stopt bij Belgian Bullets	20140507	Sport
wa1001spo1.txt	1001	Thibaut Courtois speelt finale Champions League	20140507	Sport
wa1001spo2.txt	1001	Anderlecht klopt Club Brugge	20140507	Sport
wa1001tip1.txt	1001	Neem eens het veer tussen Lillo en Doel	20140507	Tip
wa1001tip2.txt	1001	In het midden van de nacht	20140507	Tip
wa1001vp1.txt	1001	Meer geweld in Oekraïne	20140507	Voorpagina
wa1001vp2.txt	1001	11 miljoen inwoners	20140507	Voorpagina
wa1001vp3.txt	1001	Moordenaar Fortuyn vrij	20140507	Voorpagina
wa1001we1.txt	1001	Brief vanop zee	20140507	Weetjes
wa1001we2.txt	1001	Duiken in het licht	20140507	Weetjes
wa1001we3.txt	1001	Vergeet het, dames	20140507	Weetjes
wa1001we4.txt	1001	Ian Thomas verovert VS	20140507	Weetjes
wa1001we5.txt	1001	Je eigen eiland	20140507	Weetjes
wa1001we6.txt	1001	Anna achterna	20140507	Weetjes
wa1002bih1.txt	1002	Belgen zijn gek op Panini	20140514	België
wa1002bih2.txt	1002	Tomorrowland mag doorgaan	20140514	België
wa1002bik1.txt	1002	Zinneke Parade met 2.000 deelnemers	20140514	België
wa1002bik2.txt	1002	Samen een koe kopen	20140514	België
wa1002bik3.txt	1002	NMBS schrapt een aantal treinen	20140514	België
wa1002bik4.txt	1002	Autogarage wordt museum	20140514	België
wa1002bik5.txt	1002	Mogen 'stemfies' bij de verkiezingen?	20140514	België
wa1002bik6.txt	1002	Pardoen niet ontslagen	20140514	België
wa1002bik7.txt	1002	Geen boete, wel een cursus	20140514	België
wa1002bik8.txt	1002	Twee duikers sterven in Ourthe	20140514	België
wa1002bin1.txt	1002	CLB's begeleiden één op drie leerlingen	20140514	België
wa1002bin2.txt	1002	Computer Buitenlandse Zaken gekraakt	20140514	België
wa1002bin3.txt	1002	Meer dan 6% van sociale woningen staat leeg	20140514	België
wa1002bin4.txt	1002	Discussie over route van vliegtuigen	20140514	België
wa1002bui1.txt	1002	Wereld wil Nigeria helpen	20140514	Buitenland
wa1002bui2.txt	1002	ANC wint verkiezingen in Zuid-Afrika	20140514	Buitenland
wa1002bui3.txt	1002	Rebellen verlaten Homs	20140514	Buitenland
wa1002bui4.txt	1002	Gevechten breken weer uit in Zuid-Soedan	20140514	Buitenland
wa1002bui5.txt	1002	Stemming in het oosten van Oekraïne	20140514	Buitenland
wa1002buk1.txt	1002	Vluchtelingen sterven op zee	20140514	Buitenland
wa1002buk2.txt	1002	Crisis in Europa is voorbij	20140514	Buitenland
wa1002buk3.txt	1002	Premier Thailand moet aftreden	20140514	Buitenland
wa1002buk4.txt	1002	Terechtstellingen Oklahoma uitgesteld	20140514	Buitenland
wa1002idk1.txt	1002	Wie werkt, is winst voor de samenleving	20140514	In de kijker
wa1002idk2.txt	1002	Met sp.a kies je voor welvaart voor iedereen	20140514	In de kijker
wa1002mening.txt	1002	Geef het op, VRT	20140514	Mening
wa1002sam1.txt	1002	De stille Kempen pakken drugs aan	20140514	Samenleving
wa1002sam2.txt	1002	Onze aanpak is uniek	20140514	Samenleving
wa1002spk1.txt	1002	Engelse titel voor Kompany	20140514	Sport
wa1002spk2.txt	1002	Giro van start in Noord-Ierland	20140514	Sport
wa1002spk3.txt	1002	Wereldkampioen snooker is Selby	20140514	Sport
wa1002spk4.txt	1002	Roeselare is kampioen volleybal	20140514	Sport
wa1002spo1.txt	1002	Anderlecht leidt Play-off 1	20140514	Sport
wa1002tip1.txt	1002	Het beloofde land	20140514	Tip
wa1002tip2.txt	1002	Kunst, cultuur en oorlog	20140514	Tip
wa1002tip3.txt	1002	Opscheppen over rabarber	20140514	Tip
wa1002vp1.txt	1002	Breng onze meisjes terug	20140514	Voorpagina
wa1002vp2.txt	1002	Conchita Wurst wint Eurosong	20140514	Voorpagina
wa1002we1.txt	1002	Kopers gezocht	20140514	Weetjes
wa1002we2.txt	1002	Tussen hemel en hel	20140514	Weetjes
wa1002we3.txt	1002	Rocco verovert Italië	20140514	Weetjes
wa1002we4.txt	1002	Rocco verovert Italië	20140514	Weetjes
wa1002we5.txt	1002	Klant heeft zelden gelijk'	20140514	Weetjes
wa1002we6.txt	1002	Grot te huur	20140514	Weetjes
wa1003bih1.txt	1003	Dode bij '20 kilometer door Brussel'	20140519	België
wa1003bih2.txt	1003	Vlaamse acteurs verdienen te weinig	20140519	België
wa1003bik1.txt	1003	Verdachte Bende van Nijvel opgepakt	20140519	België
wa1003bik2.txt	1003	Child Focus bereikbaar via chatbox	20140519	België
wa1003bik3.txt	1003	Opnieuw spaarpunten van Artis-Historia	20140519	België
wa1003bik4.txt	1003	Veel geweld tegen holebi's	20140519	België
wa1003bik5.txt	1003	Eerste bord tegen zelfmoord	20140519	België
wa1003bik6.txt	1003	Meer hackers bij overheid	20140519	België
wa1003bik7.txt	1003	Tomorrowland krijgt vergunning	20140519	België
wa1003bik8.txt	1003	36 ambtenaren met slecht rapport	20140519	België
wa1003bin1.txt	1003	Jean-Luc Dehaene is overleden	20140519	België
wa1003bin3.txt	1003	Politie zet minder honden in	20140519	België
wa1003bui1.txt	1003	301 mijnwerkers sterven in Turkije	20140519	Buitenland
wa1003bui2.txt	1003	Boko Haram toont ontvoerde meisjes	20140519	Buitenland
wa1003bui3.txt	1003	150 windmolens in de Noordzee	20140519	Buitenland
wa1003buk1.txt	1003	70 doden bij onrust in Libië	20140519	Buitenland
wa1003buk2.txt	1003	Bemiddelaar Syrië stopt	20140519	Buitenland
wa1003buk3.txt	1003	Overstromingen in Bosnië en in Servië	20140519	Buitenland
wa1003buk4.txt	1003	Chinezen verlaten Vietnam	20140519	Buitenland
wa1003idk1.txt	1003	"Wouter Beke: ""Wij doen iets met de stemmen van de kiezers"""	20140519	In de kijker
wa1003idk2.txt	1003	"Ben Weyts (ondervoorzitter N-VA): ""Liever geen federale regering met de PS"""	20140519	In de kijker
wa1003mening.txt	1003	Stem niet foert!	20140519	Mening
wa1003sam1.txt	1003	Marianne Thyssen over de Europese verkiezingen	20140519	Samenleving
wa1003spk1.txt	1003	Spaanse titel voor Courtois	20140519	Sport
wa1003spk2.txt	1003	Europa League voor Sevilla	20140519	Sport
wa1003spk3.txt	1003	Ann Wauters heeft nieuwe club	20140519	Sport
wa1003spo1.txt	1003	Anderlecht pakt de titel	20140519	Sport
wa1003spo2.txt	1003	Timmy Simons niet mee naar Brazilië	20140519	Sport
wa1003tip1.txt	1003	Wie zijn onze politici?	20140519	Tip
wa1003tip2.txt	1003	Feest in Kasteel Bouckenborg	20140519	Tip
wa1003tip3.txt	1003	Dag Barcelona!	20140519	Tip
wa1003vp1.txt	1003	Turkije verwerkt mijnramp	20140519	Voorpagina
wa1003vp2.txt	1003	Gratis stemmen met de trein	20140519	Voorpagina
wa1003vp3.txt	1003	Regering India verliest zwaar	20140519	Voorpagina
wa1003we1.txt	1003	Kinderen op de vlucht	20140519	Weetjes
wa1003we2.txt	1003	Kasteel van Dracula staat te koop	20140519	Weetjes
wa1003we3.txt	1003	Conchita is ook een worst	20140519	Weetjes
wa1003we4.txt	1003	Goedele helpt scheiden	20140519	Weetjes
wa1003we5.txt	1003	Natalia in clip van Urbanus	20140519	Weetjes
wa1004bih1.txt	1004	Verkiezing 2014: Alle uitslagen op een rij	20140528	België
wa1004bik1.txt	1004	Tom wint 'The Voice'	20140528	België
wa1004bik2.txt	1004	Straffen voor 19 terroristen	20140528	België
wa1004bik3.txt	1004	Nieuw wachtwoord nodig voor eBay	20140528	België
wa1004bik4.txt	1004	Maak flitscontroles niet bekend	20140528	België
wa1004bin1.txt	1004	Nieuwe borden langs snelweg	20140528	België
wa1004bin2.txt	1004	Schutter maakt drie doden	20140528	België
wa1004bin3.txt	1004	EU wil regels over datum aanpassen	20140528	België
wa1004bui1.txt	1004	EVP blijft de grootste partij	20140528	Buitenland
wa1004bui2.txt	1004	Leger neemt macht over van de regering	20140528	Buitenland
wa1004bui4.txt	1004	Geweld bij verkiezingen in Oekraïne	20140528	Buitenland
wa1004bui5.txt	1004	Franse treinen zijn te breed	20140528	Buitenland
wa1004bui6.txt	1004	Alweer aanslag bij Oeigoeren	20140528	Buitenland
wa1004buk1.txt	1004	Voedsel voor Aleppo	20140528	Buitenland
wa1004buk2.txt	1004	Nieuwe aanslagen in Nigeria	20140528	Buitenland
wa1004buk3.txt	1004	Vluchtelingen Eritrea in Nederland	20140528	Buitenland
wa1004buk4.txt	1004	Koop geen Amazone-hout	20140528	Buitenland
wa1004idk1.txt	1004	Wat zeggen politici over de uitslag?	20140528	In de kijker
wa1004idk2.txt	1004	Carl Devos geeft uitleg bij de verkiezingen	20140528	In de kijker
wa1004idk3.txt	1004	Welke politici haalden veel stemmen?	20140528	In de kijker
wa1004mening.txt	1004	Winnaars en verliezers	20140528	Mening
wa1004sam1.txt	1004	"Juf Joke is Leraar van het Jaar: ""Ik blijf gewoon mezelf"""	20140528	Samenleving
wa1004sam2.txt	1004	Groot zijn in kleine dingen	20140528	Samenleving
wa1004spk1.txt	1004	Rosberg wint GP van Monaco	20140528	Sport
wa1004spk2.txt	1004	Rode Duivels bereiden WK voor	20140528	Sport
wa1004spo1.txt	1004	Niels Albert stopt met wielrennen	20140528	Sport
wa1004spo2.txt	1004	Real Madrid wint Champions League	20140528	Sport
wa1004tip1.txt	1004	Marcel Vanthilt opent 'Hotel M'	20140528	Tip
wa1004tip2.txt	1004	Wandel tussen lavendel in Limburg	20140528	Tip
wa1004tip3.txt	1004	Straatkat	20140528	Tip
wa1004vp.txt	1004	N-VA is de grote winnaar	20140528	Voorpagina
wa1004vp1.txt	1004	Drie doden bij aanslag in Brussel	20140528	Voorpagina
wa1004we1.txt	1004	Laag vliegen	20140528	Weetjes
wa1004we2.txt	1004	Schrijven op je huid	20140528	Weetjes
wa1004we3.txt	1004	Milow botst met dure auto	20140528	Weetjes
wa1004we4.txt	1004	Liedjes van een vampier	20140528	Weetjes
wa1004we5.txt	1004	Laat bubbels ontploffen!	20140528	Weetjes
wa1004we6.txt	1004	Schapen op begrafenis	20140528	Weetjes
wa1005bih1.txt	1005	Bart De Wever is informateur	20140604	België
wa1005bik1.txt	1005	Uplace is vergunning kwijt	20140604	België
wa1005bik2.txt	1005	City Parade lokt 150.000 mensen	20140604	België
wa1005bik3.txt	1005	Prins Amedeo trouwt op 5 juli	20140604	België
wa1005bik4.txt	1005	Van Rompuy krijgt prijs van Europa	20140604	België
wa1005bik5.txt	1005	Belgen gokken veel online	20140604	België
wa1005bik6.txt	1005	Meer Belgen krijgen euthanasie	20140604	België
wa1005bik7.txt	1005	Huis renoveren wordt duurder	20140604	België
wa1005bik8.txt	1005	Politie betrapt 1,5 miljoen hardrijders	20140604	België
wa1005bin1.txt	1005	Actie tegen kanker zorgt voor 2,5 miljoen euro	20140618	België
wa1005bin2.txt	1005	Jongen van 19 jaar sterft door geweld	20140618	België
wa1005bin3.txt	1005	Aanslag in Joods Museum	20140604	België
wa1005bui1.txt	1005	Terreur in Nigeria	20140604	Buitenland
wa1005bui2.txt	1005	Van Rompuy zoekt oplossing	20140618	Buitenland
wa1005buk1.txt	1005	Euraziatische Unie start	20140604	Buitenland
wa1005buk2.txt	1005	Zoektocht naar vliegtuig gestopt	20140604	Buitenland
wa1005buk3.txt	1005	Al-Sisi wint in Egypte	20140604	Buitenland
wa1005buk4.txt	1005	Opnieuw schokt verkrachting India	20140604	Buitenland
wa1005idk.txt	1005	Brazilië van a tot z	20140604	In de kijker
wa1005mening.txt	1005	Kiezer	20140604	Mening
wa1005sam1.txt	1005	Gevonden voorwerpen bij de NMBS	20140604	Samenleving
wa1005sam2.txt	1005	Schat of prul	20140604	Samenleving
wa1005spk1.txt	1005	Geen Belgen meer op Roland Garros	20140604	Sport
wa1005spk2.txt	1005	Qatar kocht WK 2022 om	20140604	Sport
wa1005spk3.txt	1005	Thiam verbetert record	20140604	Sport
wa1005spk4.txt	1005	Tigers oefenen zwakjes	20140604	Sport
wa1005spo1.txt	1005	Tony Martin wint de Ronde van België	20140604	Sport
wa1005spo2.txt	1005	Rode Duivels oefenen voor het WK	20140604	Sport
wa1005spo3.txt	1005	Quintana wint de Giro	20140604	Sport
wa1005tip.txt	1005	Thuis in Kortrijk	20140604	Tip
wa1005tip2.txt	1005	Frans Bauer zingt in Puyenbroeck	20140618	Tip
wa1005tip3.txt	1005	Sprookjes	20140604	Tip
wa1005vp.txt	1005	Verdachte van aanslag opgepakt	20140604	Voorpagina
wa1005vp1.txt	1005	Eén op drie is te zwaar	20140604	Voorpagina
wa1005vp2.txt	1005	NSA verzamelt je foto	20140604	Voorpagina
wa1005we1.txt	1005	Een wereld van 'selfies'	20140604	Weetjes
wa1005we2.txt	1005	Els De Schepper wint prijs	20140604	Weetjes
wa1005we3.txt	1005	Google maakt auto zonder stuur	20140604	Weetjes
wa1005we4.txt	1005	Geen Harry en Olga meer	20140604	Weetjes
wa1005we5.txt	1005	Oudste vrouw werd 112	20140604	Weetjes
wa1005we6.txt	1005	Geit in hongerstaking	20140604	Weetjes
wa1006bik1.txt	1006	Eerste baby met dubbele achternaam	20140612	België
wa1006bik2.txt	1006	Meer mensen op zwarte lijst	20140612	België
wa1006bik3.txt	1006	Instaptoets voor leerkrachten	20140612	België
wa1006bik4.txt	1006	Weinig mensen met beperking bij overheid	20140612	België
wa1006bin1.txt	1006	Koning tegen koning	20140612	België
wa1006bin2.txt	1006	Ziekte treft Belgische bijen	20140612	België
wa1006bin3.txt	1006	Moorden in Wevelgem	20140612	België
wa1006bui1.txt	1006	Protesten in Brazilië	20140612	Buitenland
wa1006bui2.txt	1006	Nieuwe koning Spanje	20140612	Buitenland
wa1006bui3.txt	1006	G7 tegen Rusland	20140612	Buitenland
wa1006buk1.txt	1006	Ebola maakt meer dan 200 doden	20140612	Buitenland
wa1006buk2.txt	1006	Nieuwe planten en dieren ontdekt	20140612	Buitenland
wa1006buk3.txt	1006	Al-Assad blijftpresident	20140612	Buitenland
wa1006buk4.txt	1006	Kinderen sterven in katholiek tehuis	20140612	Buitenland
wa1006idk1.txt	1006	De Rode Duivels in Brazilië	20140612	In de kijker
wa1006idk2.txt	1006	België op de WK's van lang geleden	20140612	In de kijker
wa1006idk3.txt	1006	WK's zonder de Belgen	20140612	In de kijker
wa1006mening.txt	1006	De mening van Dominique	20140612	Mening
wa1006tip1.txt	1006	Eens iets anders dan voetbal	20140612	Tip
wa1006tip2.txt	1006	Festival 'Beeldig Lommel'	20140612	Tip
wa1006tip3.txt	1006	Mijn kampioen	20140612	Tip
wa1007bih1.txt	1007	Festival voor Ringland lokt 15.000 mensen	20140618	België
wa1007bih2.txt	1007	Wonen wordt te duur	20140618	België
wa1007bik1.txt	1007	Beweging.net is nieuwe naam van ACW	20140618	België
wa1007bik2.txt	1007	Met de auto naar Italië is duur	20140618	België
wa1007bik3.txt	1007	Hagel beschadigt 42.000 auto's	20140618	België
wa1007bik4.txt	1007	Kind eet steeds ongezonder	20140618	België
wa1007bik5.txt	1007	Kerncentrales langer dicht	20140618	België
wa1007bik6.txt	1007	Ik verloste enkel oude mensen	20140618	België
wa1007bik7.txt	1007	Evenveel vragen voor hulp bij handicap	20140618	België
wa1007bik8.txt	1007	Leerlingen BSO scoren slecht	20140618	België
wa1007bin1.txt	1007	Delhaize sluit 14 winkels	20140618	België
wa1007bin2.txt	1007	Maatregelen om armoede bij kinderen te bestrijden	20140618	België
wa1007bin3.txt	1007	Zes partijen maken Brusselse regering	20140618	België
wa1007bui1.txt	1007	Vissers werken als slaven	20140618	Buitenland
wa1007bui2.txt	1007	Radicale rebellen rukken op	20140618	Buitenland
wa1007bui3.txt	1007	"Angelina Jolie: ""Verkrachting moet stoppen"""	20140618	Buitenland
wa1007buk1.txt	1007	Crisis in Oekraïne duurt voort	20140618	Buitenland
wa1007buk2.txt	1007	Graf met 800 lijken in Peru	20140618	Buitenland
wa1007buk3.txt	1007	Geen bewijs voor dode Ierse kinderen	20140618	Buitenland
wa1007idk1.txt	1007	De langste dag en de kortste nacht	20140618	In de kijker
wa1007idk2.txt	1007	De stenen van Stonehenge	20140618	In de kijker
wa1007idk3.txt	1007	Wat gebeurt er tijdens de zonnewende?	20140618	In de kijker
wa1007idk4.txt	1007	Het is onze band met de natuur	20140618	In de kijker
wa1007mening.txt	1007	Soms weet je iets liever niet	20140618	Mening
wa1007sam1.txt	1007	Ontsnap aan het WK voetbal	20140618	Samenleving
wa1007spk1.txt	1007	Geen halve finale op WK hockey	20140618	Sport
wa1007spk2.txt	1007	Oostende weer kampioen basketbal	20140618	Sport
wa1007spk3.txt	1007	Gokchinees is schuldig	20140618	Sport
wa1007spk4.txt	1007	Geen halve punten meer in Play-offs'	20140618	Sport
wa1007spo1.txt	1007	Scheidsrechter helpt Brazilië	20140618	Sport
wa1007spo2.txt	1007	Nederland verrast	20140618	Sport
wa1007spo3.txt	1007	Talansky klopt Froome	20140618	Sport
wa1007tip1.txt	1007	De wereld van Bellewaerde'	20140618	Tip
wa1007tip2.txt	1007	Ontdek de Titanic	20140618	Tip
wa1007tip3.txt	1007	Trottinettentocht	20140618	Tip
wa1007vp1.txt	1007	ISIS rukt op in Irak	20140618	Voorpagina
wa1007vp2.txt	1007	Jan Becaus senator voor N-VA	20140618	Voorpagina
wa1007we1.txt	1007	Pret op het strand van Gaza	20140618	Weetjes
wa1007we2.txt	1007	Oudste man is dood	20140618	Weetjes
wa1007we3.txt	1007	Bekende Vlamingen zijn een koppel	20140618	Weetjes
wa1007we4.txt	1007	An Lemmens verwacht eerste kind	20140618	Weetjes
wa1007we5.txt	1007	Een postzegel van 14 miljoen euro	20140618	Weetjes
wa1007we6.txt	1007	25 jaar achterwaarts	20140618	Weetjes
wa1008bih1.txt	1008	Minder kleine winkels in België	20140625	België
wa1008bih2.txt	1008	Steeds minder jonge moeders	20140625	België
wa1008bik1.txt	1008	Motorrijders vragen meer respect	20140625	België
wa1008bik2.txt	1008	Bonnenman slaat weer toe	20140625	België
wa1008bik3.txt	1008	Oxfam erft veel geld	20140625	België
wa1008bik4.txt	1008	Klachten over 'Vis van het jaar'	20140625	België
wa1008bik5.txt	1008	NMBS houdt vroege en late treinen	20140625	België
wa1008bik6.txt	1008	Weinig jongeren krijgen GAS-boete	20140625	België
wa1008bik7.txt	1008	Grootkeukens niet proper genoeg	20140625	België
wa1008bik8.txt	1008	Afghanen krijgen vaak papieren	20140625	België
wa1008bin1.txt	1008	N-VA kiest voor de Conservatieven in Europa	20140625	België
wa1008bin2.txt	1008	Leraar verdacht van seksueel misbruik	20140625	België
wa1008bin3.txt	1008	Geen steun meer voor biocentrales	20140625	België
wa1008bui1.txt	1008	51 miljoen vluchtelingen	20140625	Buitenland
wa1008bui2.txt	1008	Amerikanen gaan niet vechten tegen ISIS	20140625	Buitenland
wa1008bui3.txt	1008	Nieuwe wonderen	20140625	Buitenland
wa1008buk1.txt	1008	Zet geen kinderen in als soldaat	20140625	Buitenland
wa1008buk2.txt	1008	Man uit grot gered na elf dagen	20140625	Buitenland
wa1008buk3.txt	1008	Bergtop eraf voor telescoop	20140625	Buitenland
wa1008buk4.txt	1008	Nazibewaker opgepakt	20140625	Buitenland
wa1008idk1.txt	1008	Het geheugen van de wereld	20140625	In de kijker
wa1008idk2.txt	1008	Voorstel en keuze	20140625	In de kijker
wa1008idk3.txt	1008	Het geheugen van de wereld: een paar voorbeelden	20140625	In de kijker
wa1008idk4.txt	1008	Het Mundaneum: Voorloper van het internet	20140625	In de kijker
wa1008mening.txt	1008	Vlaggen in Brussel	20140625	Mening
wa1008sam1.txt	1008	Een groen dak op de Ring rond Antwerpen	20140625	Samenleving
wa1008spk1.txt	1008	Derde zege voor Rosberg	20140625	Sport
wa1008spk2.txt	1008	Club Brugge rookvrij	20140625	Sport
wa1008spo1.txt	1008	Wereldkampioen Spanje moet naar huis	20140625	Sport
wa1008spo2.txt	1008	Philippe Gilbert is klaar voor BK	20140625	Sport
wa1008tip1.txt	1008	Het drama van Romeo en Julia met popmuziek	20140625	Tip
wa1008tip2.txt	1008	Nederlands lezen met De Samenlezing	20140625	Tip
wa1008tip3.txt	1008	Later kinderen krijgen is niet altijd keuze	20140625	Tip
wa1008vp1.txt	1008	Rode Duivels gaan door	20140625	Voorpagina
wa1008vp2.txt	1008	Stromae start Amerikaans avontuur	20140625	Voorpagina
wa1008we1.txt	1008	Naakt op de fiets	20140625	Weetjes
wa1008we2.txt	1008	Plaag van kwallen aan onze kust	20140625	Weetjes
wa1008we3.txt	1008	Kristel van K3 in nieuwe tv-serie	20140625	Weetjes
wa1008we4.txt	1008	Peter Van Asbroeck weer vervangen	20140625	Weetjes
wa1008we5.txt	1008	Wesp krijgt naam van Koning Filip	20140625	Weetjes
wa1009bih1.txt	1009	Luchtverkeer staakt	20140917	België
wa1009bih2.txt	1009	Betalen voor boterhammen	20140917	België
wa1009bik1.txt	1009	Koning op doos met koekjes	20140917	België
wa1009bik2.txt	1009	Bellen in Europa wordt goedkoper	20140917	België
wa1009bik3.txt	1009	Baby dolfijn heet Origi	20140917	België
wa1009bik4.txt	1009	Te weinig koks	20140917	België
wa1009bik5.txt	1009	Aantal immigranten daalde in 2012	20140917	België
wa1009bik6.txt	1009	Meer donoren voor sperma nodig	20140917	België
wa1009bik7.txt	1009	Ontslagen bij Bosch	20140917	België
wa1009bik8.txt	1009	Belgen leveren 3.100 wapens in	20140917	België
wa1009bin1.txt	1009	Charles Michel is informateur	20140917	België
wa1009bin2.txt	1009	Seizoen van festivals gestart	20140917	België
wa1009bin3.txt	1009	Motorbende handelt in drugs	20140917	België
wa1009bui1.txt	1009	EU-top in Ieper herdenkt Wereldoorlog 1	20140917	Buitenland
wa1009bui2.txt	1009	Ebola doodt  honderden mensen	20140917	Buitenland
wa1009bui3.txt	1009	ISIS roept Islamitische staat uit	20140917	Buitenland
wa1009buk1.txt	1009	Schandaal treft Greenpeace	20140917	Buitenland
wa1009buk2.txt	1009	Oekraïners vluchten	20140917	Buitenland
wa1009buk3.txt	1009	Journalisten veroordeelt in Egypte	20140917	Buitenland
wa1009buk4.txt	1009	Zoektocht naar MH370 gaat voort	20140917	Buitenland
wa1009idk1.txt	1009	Transformers: Age of extinction	20140917	In de kijker
wa1009idk2.txt	1009	Hoe tem je een draak 2	20140917	In de kijker
wa1009idk3.txt	1009	Planes 2	20140917	In de kijker
wa1009idk4.txt	1009	Dawn of the planet of the apes	20140917	In de kijker
wa1009idk5.txt	1009	Lucy	20140917	In de kijker
wa1009idk6.txt	1009	Guardians of the galaxy	20140917	In de kijker
wa1009idk7.txt	1009	The Expendables 3	20140917	In de kijker
wa1009mening.txt	1009	Boterham	20140917	Mening
wa1009sam1.txt	1009	De vakantie van Ibrahim	20140917	Samenleving
wa1009sam2.txt	1009	De vakantie van Leen	20140917	Samenleving
wa1009sam3.txt	1009	De vakantie van Karina	20140917	Samenleving
wa1009sam4.txt	1009	De vakantie van Winke	20140917	Samenleving
wa1009sam5.txt	1009	De vakantie van Dominique	20140917	Samenleving
wa1009sam6.txt	1009	De vakantie van Michel	20140917	Samenleving
