wa1083bui3.txt	1083	Chinezen vieren nieuwjaar	20160203	Buitenland
wa1083buk1.txt	1083	Samen aan de Klaagmuur	20160204	Buitenland
wa1083buk2.txt	1083	Man met wapens in Disneyland	20160203	Buitenland
wa1083buk3.txt	1083	Grote dag voor politiek in Myanmar	20160204	Buitenland
wa1083idk1.txt	1083	Je voelt het al, het is weer carnaval	20160204	In de kijker
wa1083idk2.txt	1083	Carnaval bij ons	20160203	In de kijker
wa1083idk3.txt	1083	Niet lachen met terreur	20160204	In de kijker
wa1083idk4.txt	1083	Carnaval overal ter wereld	20160203	In de kijker
wa1083idk5.txt	1083	Alles moet kunnen of slechte smaak?	20160203	In de kijker
wa1083mening.txt	1083	Meer folklore dan sport	20160204	Mening
wa1083sam1.txt	1083	Maak je geen zorgen en geniet	20160204	Samenleving
wa1083sam2.txt	1083	De groepsreizen leerden me veel	20160204	Samenleving
wa1083spk1.txt	1083	Kevin De Bruyne lang aan de kant	20160204	Sport
wa1083spk2.txt	1083	Ann Wauters terug bij Belgian Cats	20160204	Sport
wa1083spk3.txt	1083	Evi Van Acker zeilt naar goud	20160204	Sport
wa1083spk4.txt	1083	Amerikanen winnen Marathon Challenge	20160203	Sport
wa1083spo1.txt	1083	Motor in fiets ontdekt bij Belgische renster	20160204	Sport
wa1083spo2.txt	1083	Kerber en Djokovic winnen	20160203	Sport
wa1083spo3.txt	1083	Job van trainer Hasi is bedreigd	20160204	Sport
wa1083tip1.txt	1083	Wintervonken	20160204	Tip
wa1083tip2.txt	1083	Aalst viert carnaval	20160203	Tip
wa1083vp1.txt	1083	Wout van Aert is wereldkampioen	20160204	Voorpagina
wa1083vp2.txt	1083	Vluchtelingen moeten terug na de oorlog	20160203	Voorpagina
wa1083we1.txt	1083	Allemaal streepjes	20160203	Weetjes
wa1083we2.txt	1083	Gewoon duur	20160204	Weetjes
wa1083we3.txt	1083	Wordt 'Blokken' 25 jaar?	20160203	Weetjes
wa1083we4.txt	1083	Laura zingt op dag twee	20160204	Weetjes
wa1083we5.txt	1083	Tv zoekt nonnen	20160203	Weetjes
wa1083we6.txt	1083	Ludivine rent	20160203	Weetjes
wa1084bih1.txt	1084	Jongeren drinken te veel alcohol	20160210	België
wa1084bih2.txt	1084	Eddy Wally is overleden	20160210	België
wa1084bik1.txt	1084	Andere regel voor jonge voetballer	20160210	België
wa1084bik2.txt	1084	Erfenis van koningin Fabiola is afgerond	20160210	België
wa1084bik3.txt	1084	Water steeds vaker te duur	20160210	België
wa1084bik4.txt	1084	Gemeenten schrappen zondagsrust	20160210	België
wa1084bik5.txt	1084	Juf Blokkendoos onschuldig	20160210	België
wa1084bik6.txt	1084	Student wil vaker einde aan leven	20160210	België
wa1084bik7.txt	1084	IS toont man uit Antwerpen in film	20160210	België
wa1084bik8.txt	1084	Museum vangt regen op in emmers	20160210	België
wa1084bin1.txt	1084	Opvang op het water	20160210	België
wa1084bin2.txt	1084	Gouverneur schokt met uitspraak	20160210	België
wa1084bin3.txt	1084	Strijd tegen koning Albert gaat voort	20160210	België
wa1084bui1.txt	1084	Zika-virus rukt verder op	20160210	Buitenland
wa1084bui2.txt	1084	Op naar 'Super Dinsdag'	20160210	Buitenland
wa1084bui3.txt	1084	200 miljoen vrouwen en meisjes verminkt	20160210	Buitenland
wa1084buk1.txt	1084	Zware aardbeving treft Taiwan	20160210	Buitenland
wa1084buk2.txt	1084	Vrede ver weg voor Syrië	20160210	Buitenland
wa1084buk3.txt	1084	President Obama bezoekt moskee	20160210	Buitenland
wa1084buk4.txt	1084	Misbruik door blauwhelmen	20160210	Buitenland
wa1084idk1.txt	1084	Valentijn in het rusthuis	20160210	In de kijker
wa1084idk2.txt	1084	Hoe ouder ik word, hoe liever ik hem zie	20160210	In de kijker
wa1084idk3.txt	1084	Ja, het is grote liefde	20160210	In de kijker
wa1084idk4.txt	1084	We zwijgen ook veel samen	20160210	In de kijker
wa1084mening.txt	1084	Propere beek	20160210	Mening
wa1084sam1.txt	1084	We noemen ze 'kleine helden', maar het zijn helden zonder meer	20160210	Samenleving
wa1084sam2.txt	1084	Helden van bij ons	20160210	Samenleving
wa1084spk1.txt	1084	Club houdt Gent uit finale	20160210	Sport
wa1084spk2.txt	1084	Ann Wauters naar Turkse ploeg	20160210	Sport
wa1084spk3.txt	1084	Eerste medaille voor Belgian Bullets	20160210	Sport
wa1084spo1.txt	1084	Club Brugge is de nieuwe leider	20160210	Sport
wa1084spo2.txt	1084	Wereldkampioen kan alles winnen	20160210	Sport
wa1084spo3.txt	1084	Broncos winnen Super Bowl	20160210	Sport
wa1084tip1.txt	1084	Liefde zoals de eerste keer	20160210	Tip
wa1084tip2.txt	1084	Hij zet de wereld stil	20160210	Tip
wa1084vp1.txt	1084	Carnaval Aalst lacht met alles	20160210	Voorpagina
wa1084vp2.txt	1084	We rijden 25.000 dieren per dag dood	20160210	Voorpagina
wa1084we1.txt	1084	Rare zebra wil ontsnappen in Tokio	20160210	Weetjes
wa1084we2.txt	1084	Vensterbank blijft leeg	20160210	Weetjes
wa1084we3.txt	1084	Sien en Maria maken cellen proper	20160210	Weetjes
wa1084we4.txt	1084	Clouseau danst opnieuw	20160210	Weetjes
wa1084we5.txt	1084	Zica-auto?	20160210	Weetjes
wa1084we6.txt	1084	Eerste baby in 28 jaar	20160210	Weetjes
wa1085bih1.txt	1085	Is panda Hao Hao zwanger?	20160217	België
wa1085bih2.txt	1085	Kan 'Turteltaks' dalen?	20160217	België
wa1085bik1.txt	1085	Soldaten klagen over te veel werk	20160217	België
wa1085bik2.txt	1085	Engels mag niet op parkeerschijf	20160217	België
wa1085bik3.txt	1085	Belg ontwerpt hoes voor Kanye West	20160217	België
wa1085bik4.txt	1085	Zoo neemt afscheid van nijlpaard Heini	20160217	België
wa1085bik5.txt	1085	Meer hulp werkt om job te zoeken	20160217	België
wa1085bik6.txt	1085	Oudste Belg werd 111 jaar	20160217	België
wa1085bik7.txt	1085	Griep is in het land	20160217	België
wa1085bik8.txt	1085	Hulplijn tegen radicale ideeën	20160217	België
wa1085bin1.txt	1085	Toekomst GAS-boetes onzeker	20160217	België
wa1085bin2.txt	1085	Wit voor Wally	20160217	België
wa1085bin3.txt	1085	Minder Belgen willen rijbewijs	20160217	België
wa1085bui1.txt	1085	Na 1.000 jaar opnieuw samen	20160217	Buitenland
wa1085bui2.txt	1085	Oorlog gaat gewoon door	20160217	Buitenland
wa1085bui3.txt	1085	5,5 miljoen doden per jaar	20160217	Buitenland
wa1085bui4.txt	1085	Bewaker Auschwitz voor rechter	20160217	Buitenland
wa1085bui5.txt	1085	Ongeval met treinen maakt 11 doden	20160217	Buitenland
wa1085bui6.txt	1085	IJsberg doodde al 150.000 pinguïns	20160217	Buitenland
wa1085buk1.txt	1085	49 gevangenen dood bij rellen	20160217	Buitenland
wa1085buk2.txt	1085	Redders stoppen met zoeken	20160217	Buitenland
wa1085buk3.txt	1085	Politie Keulen heeft 59 verdachten	20160217	Buitenland
wa1085buk4.txt	1085	NAVO-schepen tegen mensensmokkel	20160217	Buitenland
wa1085cijfer.txt	1085	Volgens een onderzoek kijkt een vrouw gemiddeld zes keer per dag in de spiegel. Vaak is een vrouw dan niet tevreden met wat ze ziet. Daarom nam een kapsalon uit Antwerpen een beslissing. De kapper besloot alle spiegels uit zijn zaak weg te doen.	20160217	Cijfer van de week
wa1085idk1.txt	1085	Op zoek naar de beste stem	20160217	In de kijker
wa1085idk2.txt	1085	Er zijn maar twee soorten zangers: goede en slechte	20160217	In de kijker
wa1085idk3.txt	1085	Kandidaten moeten hun hart volgen	20160217	In de kijker
wa1085idk4.txt	1085	Ik ben strenger dan vroeger	20160217	In de kijker
wa1085mening.txt	1085	Roken	20160217	Mening
wa1085sam1.txt	1085	Wil je met me trouwen?	20160217	Samenleving
wa1085sam2.txt	1085	Breek de wet	20160217	Samenleving
wa1085spk1.txt	1085	Wout van Aert wint alles	20160217	Sport
wa1085spk2.txt	1085	Vincent Kompany speelt weer mee	20160217	Sport
wa1085spk3.txt	1085	Herentals wint Beker in ijshockey	20160217	Sport
wa1085spo1.txt	1085	Charly Musonda Junior scoort	20160217	Sport
wa1085tip1.txt	1085	Shit of Mouse keert terug	20160217	Tip
wa1085tip2.txt	1085	Mode is kunst	20160217	Tip
wa1085vp1.txt	1085	Rechters luisteren goed naar kinderen	20160217	Voorpagina
wa1085vp2.txt	1085	Rel over brood	20160217	Voorpagina
wa1085we1.txt	1085	Pepers drogen in India	20160217	Weetjes
wa1085we2.txt	1085	Slapen in een schilderij	20160217	Weetjes
wa1085we3.txt	1085	Een zoontje voor Lady Linn	20160217	Weetjes
wa1085we4.txt	1085	Tiener krijgt rol in Hollywood	20160217	Weetjes
wa1085we5.txt	1085	Titanic 2' op komst	20160217	Weetjes
wa1085we6.txt	1085	Oude man berooft banken	20160217	Weetjes
wa1086bih11.txt	1086	Veel seksueel geweld op tieners	20160224	België
wa1086bih2.txt	1086	We kopen meer muziek	20160224	België
wa1086bik1.txt	1086	Mooie filmprijs voor Martha	20160224	België
wa1086bik2.txt	1086	Kritiek op terugbetalen remgeld	20160224	België
wa1086bik3.txt	1086	NK7 flitst alles en iedereen	20160224	België
wa1086bik4.txt	1086	Vorig jaar 11 doden aan overweg	20160224	België
wa1086bik5.txt	1086	Bedrijf Essers mag bos kappen	20160224	België
wa1086bik6.txt	1086	Vlaamse kinderen	20160224	België
wa1086bik7.txt	1086	Overheid betaalt meer imams	20160224	België
wa1086bik8.txt	1086	Spooktrein in Landen	20160224	België
wa1086bin1.txt	1086	Hadden terroristen plannen in Mol?	20160224	België
wa1086bin2.txt	1086	Geen terugbetaling voor rokers?	20160224	België
wa1086bin3.txt	1086	Ozark Henry spreekt bij Google	20160224	België
wa1086bui1.txt	1086	EU past regels aan voor Britten	20160224	Buitenland
wa1086bui2.txt	1086	Museveni blijft president van Oeganda	20160224	Buitenland
wa1086bui5.txt	1086	Erdogan dreigt met aanval op Koerden in Syrië	20160224	Buitenland
wa1086buk1.txt	1086	Pinguïns leven wellicht nog	20160224	Buitenland
wa1086buk2.txt	1086	Kinderen lijden in Oekraïne	20160224	Buitenland
wa1086buk3.txt	1086	Paus is tegen de doodstraf	20160224	Buitenland
wa1086buk4.txt	1086	President Obama bezoekt Cuba	20160224	Buitenland
wa1086cijfer.txt	1086	4	20160224	Cijfer van de week
wa1086idk1.txt	1086	World Press Photo	20160224	In de kijker
wa1086sam.txt	1086	Wie kent Paul McCartney nog?	20160224	Samenleving
wa1086sam2.txt	1086	Paul McCartney solo	20160224	Samenleving
wa1086spo1.txt	1086	Club Brugge is nu alleen leider	20160224	Sport
wa1086spo2.txt	1086	Sven Nys rijdt laatste koers	20160224	Sport
wa1086tip1.txt	1086	Expo 'Geborgen verborgen'	20160224	Tip
wa1086tip2.txt	1086	Gele kaders	20160224	Tip
wa1086vp1.txt	1086	Cameron riskeert alles	20160224	Voorpagina
wa1086vp2.txt	1086	Help vluchtelingen op Lesbos	20160224	Voorpagina
wa1086vp3.txt	1086	Zeker 140 doden in Syrië	20160224	Voorpagina
wa1086we1.txt	1086	Verhuis voor ander leven	20160224	Weetjes
wa1086we2.txt	1086	Vlot van Lanzarote	20160224	Weetjes
wa1086we3.txt	1086	Bidden voor schulden	20160224	Weetjes
wa1086we4.txt	1086	Dure worst	20160224	Weetjes
wa1086we5.txt	1086	Taylor Swift wint drie Grammy's	20160224	Weetjes
wa1086we6.txt	1086	Eva Daeleman terug op MNM	20160224	Weetjes
wa1087bih1.txt	1087	Regering wil geen vluchtelingen uit Calais	20160303	België
wa1087bih2.txt	1087	Verdwijnt 'jungle' van Calais?	20160303	België
wa1087bik1.txt	1087	Dalai Lama komt naar Brussel	20160303	België
wa1087bik2.txt	1087	Meer pillen tegen depressie	20160303	België
wa1087bik3.txt	1087	Rode Ridder voor Rode Kruis	20160303	België
wa1087bik4.txt	1087	Paniek om plastic in Mars-repen	20160303	België
wa1087bik5.txt	1087	Extra gevaarlijke XTC te koop	20160303	België
wa1087bik6.txt	1087	Test met wifi op de trein	20160303	België
wa1087bik7.txt	1087	Haat tegen moslims wordt groter	20160303	België
wa1087bik8.txt	1087	Albert Heijn moet winkels verkopen	20160303	België
wa1087bin1.txt	1087	De Turteltaks komt eraan	20160303	België
wa1087bin2.txt	1087	Zoo toont Matadi	20160303	België
wa1087bin3.txt	1087	Tv-kijker wordt ouder	20160303	België
wa1087bui1.txt	1087	Iran kiest toekomst	20160303	Buitenland
wa1087bui2.txt	1087	Grieken kunnen opvang vluchtelingen niet aan	20160303	Buitenland
wa1087bui3.txt	1087	Oscars voor de beste films	20160303	Buitenland
wa1087buk1.txt	1087	Messi maakt jongen blij	20160303	Buitenland
wa1087buk2.txt	1087	Nigeria schrapt spookjobs	20160303	Buitenland
wa1087buk3.txt	1087	Beetje vrede in Syrië	20160303	Buitenland
wa1087idk1.txt	1087	Besparingen zullen de patiënt niet raken	20160303	In de kijker
wa1087idk2.txt	1087	Geliefd in de politiek	20160303	In de kijker
wa1087idk3.txt	1087	De liefde is de rust in mijn leven	20160303	In de kijker
wa1087idk4.txt	1087	Over rechten en plichten	20160303	In de kijker
wa1087mening.txt	1087	Geld en sport	20160303	Mening
wa1087sam1.txt	1087	Wie weggaat, wordt wel gelukkiger	20160303	Samenleving
wa1087sam2.txt	1087	Ik zat ooit op Hotel Mama	20160303	Samenleving
wa1087spk1.txt	1087	Kompany wint de Engelse beker	20160303	Sport
wa1087spk2.txt	1087	Anderlecht uit de Europa League	20160303	Sport
wa1087spk3.txt	1087	Gokschandaal bij OH Leuven	20160303	Sport
wa1087spk4.txt	1087	Nieuwe baas voor FIFA	20160303	Sport
wa1087spo1.txt	1087	Het wielerseizoen is gestart	20160303	Sport
wa1087spo2.txt	1087	Klassieker eindigt op een gelijkspel	20160303	Sport
wa1087tip1.txt	1087	Boekenfeest voor kinderen	20160303	Tip
wa1087tip2.txt	1087	Drank is de duivel	20160303	Tip
wa1087vp1.txt	1087	Leo wint eindelijk Oscar	20160303	Voorpagina
wa1087vp2.txt	1087	Mensen in plaats van robots	20160303	Voorpagina
wa1087we1.txt	1087	Geen spatje zee	20160303	Weetjes
wa1087we2.txt	1087	Even op tafel	20160303	Weetjes
wa1087we3.txt	1087	Lok van Lennon	20160303	Weetjes
wa1087we4.txt	1087	Kylie gaat trouwen	20160303	Weetjes
wa1087we5.txt	1087	Prinses gebruikt toilet niet	20160303	Weetjes
wa1087we6.txt	1087	Naar de ruimte	20160303	Weetjes
wa1088bih1.txt	1088	Let op met foto's op Facebook	20160310	België
wa1088bih2.txt	1088	Pyjama's voor Bednet	20160310	België
wa1088bik1.txt	1088	Met Belgisch paspoort naar 174 landen	20160310	België
wa1088bik2.txt	1088	Minder hulp voor mensen met enkelband	20160310	België
wa1088bik3.txt	1088	België vertrouwt gif	20160310	België
wa1088bik4.txt	1088	Praline tegen darmkanker	20160310	België
wa1088bik5.txt	1088	Flitsmarathon op 20 april	20160310	België
wa1088bik6.txt	1088	Regering zoekt 2 miljard euro	20160310	België
wa1088bik7.txt	1088	Senioren nemen vaker de bus	20160310	België
wa1088bik8.txt	1088	Belgische vaders nemen meer verlof	20160310	België
wa1088bin1.txt	1088	Vingerafdrukken van elke Belg	20160310	België
wa1088bin2.txt	1088	Strengere regels voor tabak	20160310	België
wa1088bin3.txt	1088	Belgische F16's naar Syrië?	20160310	België
wa1088bui1.txt	1088	Geen toegang meer langs de Balkan	20160310	Buitenland
wa1088bui3.txt	1088	Mummie gevonden op zee	20160310	Buitenland
wa1088bui4.txt	1088	Rare zakenman wil president worden	20160310	Buitenland
wa1088bui5.txt	1088	Terug na 340 dagen	20160310	Buitenland
wa1088buk1.txt	1088	Stuk van MH370 gevonden	20160310	Buitenland
wa1088buk2.txt	1088	Hulp voor Syrië komt op gang	20160310	Buitenland
wa1088buk3.txt	1088	Turkije legt krant stil	20160310	Buitenland
wa1088buk4.txt	1088	Noord-Korea test raketten	20160310	Buitenland
wa1088cijfer.txt	1088	3	20160310	Cijfer van de week
wa1088idk1.txt	1088	Yazan Azmi vluchtte van Syrië naar België	20160310	In de kijker
wa1088idk2.txt	1088	Wat oorlog doet	20160310	In de kijker
wa1088idk3.txt	1088	Voor smokkelaars ben je een zak geld	20160310	In de kijker
wa1088mening.txt	1088	De grap Trump	20160310	Mening
wa1088sam1.txt	1088	Met een bril naar een andere wereld	20160310	Samenleving
wa1088sam2.txt	1088	Hoelang duurt het nog?	20160310	Samenleving
wa1088spk1.txt	1088	Swings valt en verliest	20160310	Sport
wa1088spk2.txt	1088	Brons voor De Ketele	20160310	Sport
wa1088spk3.txt	1088	België verliest in de Davis Cup	20160310	Sport
wa1088spk4.txt	1088	Fabian wint alweer Strade	20160310	Sport
wa1088spo1.txt	1088	Westerlo moet tweede klasse vrezen	20160310	Sport
wa1088tip1.txt	1088	Rome komt naar Tongeren	20160310	Tip
wa1088tip2.txt	1088	Lopen in de lente	20160310	Tip
wa1088vp1.txt	1088	Crisis bij de Republikeinen	20160310	Voorpagina
wa1088vp2.txt	1088	Vader van '@' is gestorven	20160310	Voorpagina
wa1088we1.txt	1088	Stofje per stofje	20160310	Weetjes
wa1088we2.txt	1088	Toren op je hoofd	20160310	Weetjes
wa1088we3.txt	1088	The Rolling Stones gratis in Cuba	20160310	Weetjes
wa1088we4.txt	1088	Nieuwe acteurs in 'Thuis'	20160310	Weetjes
wa1088we5.txt	1088	Frietjes voor Adam	20160310	Weetjes
wa1088we6.txt	1088	Gevaarlijke muil	20160310	Weetjes
wa1089bih2.txt	1089	Die vrije woensdag maakt een groot verschil	20160322	België
wa1089bik1.txt	1089	Koning Filip is peter van Haroun	20160322	België
wa1089bik2.txt	1089	Belgen besmet met zika-virus	20160322	België
wa1089bik3.txt	1089	Zoekmachine voor jongeren	20160322	België
wa1089bik4.txt	1089	Verbied roken in pretparken	20160322	België
wa1089bik5.txt	1089	Vingerafdrukken verplicht	20160322	België
wa1089bik6.txt	1089	Meer jongeren in TKO	20160322	België
wa1089bik7.txt	1089	Pedofiel stapt zelf naar politie	20160322	België
wa1089bik8.txt	1089	Zware straf voor 'wegpiraat'	20160322	België
wa1089bin1.txt	1089	Kraanvogels in de lucht	20160322	België
wa1089bin2.txt	1089	Rechter spreekt Scientology vrij	20160322	België
wa1089bin3.txt	1089	Akkoord in de maak bij Spoorwegen	20160322	België
wa1089bui1.txt	1089	Europa gaat op slot	20160322	Buitenland
wa1089bui2.txt	1089	Vijf jaar geleden trof tsunami Fukushima	20160322	Buitenland
wa1089bui3.txt	1089	Stropers doden veel neushoorns	20160322	Buitenland
wa1089buk1.txt	1089	Chauffeur kan president worden	20160322	Buitenland
wa1089buk2.txt	1089	Noord-Korea daagt uit	20160322	Buitenland
wa1089buk3.txt	1089	Namen van leden IS bekend?	20160322	Buitenland
wa1089buk4.txt	1089	Zware aanslag in Ivoorkust	20160322	Buitenland
wa1089cijfer.txt	1089	3	20160322	Cijfer van de week
wa1089idk1.txt	1089	De moestuin zorgt voor zalige momenten	20160322	In de kijker
wa1089idk2.txt	1089	De dikste krant van het land	20160322	In de kijker
wa1089mening.txt	1089	Doping	20160322	Mening
wa1089sam1.txt	1089	Musical 'Grease' blijft een hit	20160322	Samenleving
wa1089sam2.txt	1089	De reden van het succes	20160322	Samenleving
wa1089spk1.txt	1089	Jeroen en Louise zijn de beste	20160322	Sport
wa1089spk2.txt	1089	Oostende wint bekerfinale	20160322	Sport
wa1089spk3.txt	1089	Engeland wint 'six nations' rugby	20160322	Sport
wa1089spk4.txt	1089	Swings wint in Heerenveen	20160322	Sport
wa1089spo1.txt	1089	Leuven zakt naar tweede klasse	20160322	Sport
wa1089spo2.txt	1089	Sjarapova is betrapt op doping	20160322	Sport
wa1089spo3.txt	1089	Tim Wellens wint laatste rit Parijs-Nice	20160322	Sport
wa1089tip1.txt	1089	Kunst voor kinderen: Storm op komst!	20160322	Tip
wa1089tip2.txt	1089	Buurman houdt niet van bomen	20160322	Tip
wa1089vp1.txt	1089	Turkije voert oorlog tegen terreur	20160322	Voorpagina
wa1089vp2.txt	1089	Computer wint spel 'Go'	20160322	Voorpagina
wa1089we1.txt	1089	Omgekeerde wereld	20160322	Weetjes
wa1089we2.txt	1089	Droog onder karton	20160322	Weetjes
wa1089we3.txt	1089	Josje blijft in België	20160322	Weetjes
wa1089we4.txt	1089	Zanger AC/DC wordt doof	20160322	Weetjes
wa1089we5.txt	1089	Kilt in Italië	20160322	Weetjes
wa1089we6.txt	1089	Paard zwemt in zee	20160322	Weetjes
wa1090bih1.txt	1090	Politie pakt Abdeslam op in Molenbeek	20160322	België
wa1090bih2.txt	1090	Eerste spoor in Vorst	20160322	België
wa1090bik1.txt	1090	Wonen in een rusthuis is duur	20160322	België
wa1090bik2.txt	1090	Geschiedenis kan beter	20160322	België
wa1090bik3.txt	1090	Bijna alle tieners hebben smartphone	20160322	België
wa1090bik4.txt	1090	Helft chauffeurs vergeet 'pinkers'	20160322	België
wa1090bik5.txt	1090	Geen schoonkind met andere kleur	20160322	België
wa1090bik6.txt	1090	Meer evenwicht op tv-zenders VRT	20160322	België
wa1090bik7.txt	1090	Minder ongevallen met motoren	20160322	België
wa1090bik8.txt	1090	Bedrijven gaan weg uit Brussel	20160322	België
wa1090bin1.txt	1090	Schandaal bij politie in Antwerpen	20160322	België
wa1090bin2.txt	1090	Op straat voor 'wij-gevoel'	20160322	België
wa1090bin3.txt	1090	Begroting Vlaamse regering klopt niet	20160322	België
wa1090bui1.txt	1090	Obama bezoekt Cuba	20160322	Buitenland
wa1090bui2.txt	1090	SeaWorld stopt met orka's	20160322	Buitenland
wa1090bui3.txt	1090	Akkoord tussen Europa en Turkije	20160322	Buitenland
wa1090buk1.txt	1090	Amerika straft Noord-Korea	20160322	Buitenland
wa1090buk2.txt	1090	Onrust in de politiek in Brazilië	20160322	Buitenland
wa1090buk3.txt	1090	Nieuwe aanslag in Turkije	20160322	Buitenland
wa1090buk4.txt	1090	Russen trekken weg uit Syrië	20160322	Buitenland
wa1090cijfer.txt	1090	4	20160322	Cijfer van de week
wa1090idk1.txt	1090	Je bent zelf je instrument, dat is een heel fijn gevoel	20160322	In de kijker
wa1090idk2.txt	1090	Ons leven lijkt op dat van topsporters	20160322	In de kijker
wa1090idk3.txt	1090	Opera is helemaal niet saai en duf	20160322	In de kijker
wa1090mening.txt	1090	Eigen schuld	20160322	Mening
wa1090sam1.txt	1090	Met Google op reis door een Bruegel-schilderij	20160322	Samenleving
wa1090sam2.txt	1090	Stap in de schilderijen	20160322	Samenleving
wa1090sam3.txt	1090	De dwaze mens	20160322	Samenleving
wa1090spk1.txt	1090	Geen Belgische ploeg in Europa	20160322	Sport
wa1090spk2.txt	1090	Thorgan Hazard vervangt Eden	20160322	Sport
wa1090spk3.txt	1090	Vincent Kompany valt uit	20160322	Sport
wa1090spo1.txt	1090	Standard redt seizoen	20160322	Sport
wa1090spo2.txt	1090	Mercedes blijft te machtig	20160322	Sport
wa1090spo3.txt	1090	Wie klopt Van Avermaet?	20160322	Sport
wa1090tip1.txt	1090	Bezoek de wintertuin in de lente	20160322	Tip
wa1090tip2.txt	1090	Ouder worden is leuk	20160322	Tip
wa1090vp1.txt	1090	Frankrijk vraagt België om terrorist	20160322	Voorpagina
wa1090vp2.txt	1090	Ligt Nefertiti in geheim graf?	20160322	Voorpagina
wa1090we1.txt	1090	Grootste schip voor passagiers ter wereld	20160322	Weetjes
wa1090we2.txt	1090	Een geit als taxi in Madagaskar	20160322	Weetjes
wa1090we3.txt	1090	Elton John treedt op in Pompeï	20160322	Weetjes
wa1090we4.txt	1090	Dirk Frimout gelooft in leven buiten de aarde	20160322	Weetjes
wa1090we5.txt	1090	Bus komt één keer per jaar	20160322	Weetjes
wa1090we6.txt	1090	Duiven meten slechte lucht	20160322	Weetjes
wa1091idk1.txt	1091	Ik verwacht veel spanning	20160330	In de kijker
wa1091idk2.txt	1091	De mooiste Ronde ooit	20160330	In de kijker
wa1091idk3.txt	1091	Eindelijk vakantie	20160330	In de kijker
wa1091sam1.txt	1091	De wereld kan niet zonder	20160330	Samenleving
wa1091sam2.txt	1091	Strijd om drinkwater	20160330	Samenleving
wa1091sam3.txt	1091	Plastic als een olievlek	20160330	Samenleving
wa1091sam4.txt	1091	Op zoek naar ander leven	20160330	Samenleving
wa1091tip1.txt	1091	Buitenspeeldag 2016: Vlieg er eens uit!	20160330	Tip
wa1091tip2.txt	1091	Het gaat wel over	20160330	Tip
wa1091vp1.txt	1091	Belgen verwerken aanslagen	20160330	Voorpagina
wa1091bih1.txt	1091	Hoe de dag vol terreur verliep	20160330	België
wa1091bih2.txt	1091	Wie zijn de daders?	20160330	België
wa1091bih3.txt	1091	Rouw, onderzoek en ruzies	20160330	België
wa1091bui1.txt	1091	Karadzic krijgt 40 jaar cel	20160330	Buitenland
wa1091bui2.txt	1091	Protest tegen Obama in Argentinië	20160330	Buitenland
wa1091bui3.txt	1091	Is Shakespeare zijn schedel kwijt?	20160330	Buitenland
wa1091bui4.txt	1091	Toeristen boos op Star Wars	20160330	Buitenland
wa1091bui5.txt	1091	Vluchtelingen vast in Griekenland	20160330	Buitenland
wa1091bui6.txt	1091	Trump en Clinton maken kans	20160330	Buitenland
wa1091buk4.txt	1091	Nieuw-Zeeland houdt vlag	20160330	Buitenland
wa1091buk5.txt	1091	Volkswagen roept auto's terug	20160330	Buitenland
wa1091buk6.txt	1091	Minder lang president	20160330	Buitenland
wa1091cijfer.txt	1091	1	20160330	Cijfer van de week
wa1091spo1.txt	1091	Johan Cruijff overleden aan kanker	20160330	Sport
wa1091we1.txt	1091	Leven uit de woestijn	20160330	Weetjes
wa1091we2.txt	1091	Lekker Frans	20160330	Weetjes
wa1091we3.txt	1091	Unesco erkent worstenbroodje	20160330	Weetjes
wa1091we4.txt	1091	Ook Jaak naar 'Familie'	20160330	Weetjes
wa1091we5.txt	1091	Prinses Mia komt terug	20160330	Weetjes
wa1092bih1.txt	1092	Onderzoek naar terreur gaat voort	20160404	België
wa1092bik1.txt	1092	Luchthaven is weer open	20160404	België
wa1092bik2.txt	1092	Hotels maken verlies	20160404	België
wa1092bik3.txt	1092	FACTS lokt ruim 30.000 bezoekers	20160404	België
wa1092bik4.txt	1092	Voeder geen vogels	20160404	België
wa1092bik5.txt	1092	Kindbruiden in asielcentra	20160404	België
wa1092bik6.txt	1092	Zonnepaneel van de toekomst	20160404	België
wa1092bik7.txt	1092	Seks in rusthuis ligt moeilijk	20160404	België
wa1092bik8.txt	1092	We kopen meer huizen in Spanje	20160404	België
wa1092bin1.txt	1092	Drie leeuwtjes geboren	20160404	België
wa1092bin2.txt	1092	Vrachtwagens betalen per kilometer	20160404	België
wa1092bin3.txt	1092	Nieuwkomer moet verklaring ondertekenen	20160404	België
wa1092bui1.txt	1092	IS verliest Palmyra	20160404	Buitenland
wa1092bui2.txt	1092	EU stuurt vluchtelingen terug	20160404	Buitenland
wa1092bui3.txt	1092	Tien miljoen kinderen in gevaar	20160404	Buitenland
wa1092buk1.txt	1092	Veel geld voor baas Google	20160404	Buitenland
wa1092buk2.txt	1092	Boeing schrapt 4.000 jobs	20160404	Buitenland
wa1092buk3.txt	1092	China krijgt lichamen terug	20160404	Buitenland
wa1092buk4.txt	1092	Architecte Hadid overleden	20160404	Buitenland
wa1092idk1.txt	1092	"Aaron Malinsky:""Ook vrome joden kunnen lachen"""	20160404	In de kijker
wa1092idk2.txt	1092	De joodse verschillen	20160404	In de kijker
wa1092idk3.txt	1092	Op tv	20160404	In de kijker
wa1092idk4.txt	1092	Onze koffer staat klaar	20160404	In de kijker
wa1092mening.txt	1092	Veiligheid	20160404	Mening
wa1092sam1.txt	1092	Broers en zussen in de sport	20160404	Samenleving
wa1092spk1.txt	1092	Brugge slaat kleine kloof	20160404	Sport
wa1092spk2.txt	1092	Goffin tennist sterk in Miami	20160404	Sport
wa1092spk3.txt	1092	Ann Wauters opnieuw in WNBA	20160404	Sport
wa1092spk4.txt	1092	Uitbuiting voor WK Qatar	20160404	Sport
wa1092spo1.txt	1092	Sagan wint 100ste Ronde van Vlaanderen	20160404	Sport
wa1092spo3.txt	1092	Vandoorne meteen heel sterk	20160404	Sport
wa1092tip1.txt	1092	Het Atomium viert feest	20160404	Tip
wa1092tip2.txt	1092	Een nieuw begin	20160404	Tip
wa1092vp.txt	1092	Geheim geld ontdekt	20160404	Voorpagina
wa1092vp1.txt	1092	Nintendo maakt app	20160404	Voorpagina
wa1092we1.txt	1092	Rollen met die bal	20160404	Weetjes
wa1092we2.txt	1092	Jong geleerd	20160404	Weetjes
wa1092we3.txt	1092	Avicii kiest ander leven	20160404	Weetjes
wa1092we4.txt	1092	Geld doet veel	20160404	Weetjes
wa1092we5.txt	1092	Gil niet	20160404	Weetjes
